<?xml version="1.0" encoding="UTF-8"?>
<attackTree
        xmlns:xsi="http://www.w3.org/2001/XMLSchema-instance" xmlns=""
        xsi:noNamespaceSchemaLocation="attackTreeSimple.xsd">
    <meta>
        <title>Attack on an Web Server</title>
        <author>Daniel Fischer</author>
        <date>2017-11-19</date>
        <description>Example attack on an web server</description>
    </meta>
    <tree>
        <threat id="N0001">
            <title>Attack on web server</title>
            <description>attacking an web server</description>
            <subtree>
                <alternative id="N1001">
                    <threat id="N0002">
                        <title>Social Engineering</title>
                        <description>Get password through social engineering</description>
                        <subtree>
                            <alternative id="N1002">
                                <threat id="N0003">
                                    <title>Spear-Phishing attack</title>
                                    <description>execute a spear-phishing attack</description>
                                    <attribute key="difficulty">5.5</attribute>
                                </threat>
                                <threat id="N0004">
                                    <title>Job Interview attack</title>
                                    <description>Do a job interview and get information</description>
                                    <attribute key="difficulty">8</attribute>
                                </threat>
                                <composition id="N1003">
                                    <threat id="N0011">
                                        <title>Test</title>
                                        <description>Test</description>
                                    </threat>
                                    <threat id="N0012">
                                        <title>Test</title>
                                        <description>Test</description>
                                    </threat>
                                </composition>
                            </alternative>
                        </subtree>
                        <countermeasures>
                            <countermeasure id="N0005">
                                <title>Bla</title>
                                <description>Bla</description>
                            </countermeasure>
                        </countermeasures>
                    </threat>
                    <threat id="N0006">
                        <title>Password Brute-Force</title>
                        <description>Brute-forcing the password</description>
                        <attribute key="difficulty">3</attribute>
                        <countermeasures>
                            <composition id="N1006">
                                <countermeasure id="N0007">
                                    <title>Long password</title>
                                    <description>Set a long password</description>
                                    <attribute key="difficulty">1</attribute>
                                </countermeasure>
                                <countermeasure id="N0008">
                                    <title>Brute-Force protection</title>
                                    <description>set brute force protection</description>
                                    <attribute key="difficulty">6</attribute>
                                    <subtree>
                                        <composition id="N1007">
                                            <countermeasure id="N0009">
                                                <title>BlubAAAAAAAAAAAAAAAAAAAAAAAAAAAAAAAAAAAAAAA</title>
                                                <description>Bla</description>
                                            </countermeasure>
                                        </composition>
                                    </subtree>
                                </countermeasure>
                            </composition>
                        </countermeasures>
                    </threat>
                </alternative>
            </subtree>
            <countermeasures>
                <countermeasure id="N0010">
                    <title>Secure Webserver</title>
                    <description>Do stuff</description>
                </countermeasure>
            </countermeasures>
        </threat>
    </tree>
</attackTree>